Topic,Essay,Content_Mark,Content_Comment,Statement_Mark,Statement_Comment,Organization_Mark,Organization_Comment,Readability_Mark,Readability_Comment,Grammar_Mark,Grammar_Comment,Overall_Mark,Overall_Comment
"Evaluate a significant experience, achievement, risk you have taken, or ethical dilemma you have faced and its impact on you (500 word limit).","A misplaced foot on the accelerator instead of the brakes made me the victim of someone's careless mistake. Rushing through the dark streets of my hometown in an ambulance, I attempted to hold back my tears while two supportive Emergency Medical Technicians (EMTs) comforted me. Although I suffered a minor knee injury, the trauma of that accident still lingers.
Fast forward six years to the present. Now I am sitting in the back of the ambulance, a rookie EMT, with my purple gloves on, stethoscope around my neck, and a red medical bag in hand. I am also making sure we have the proper medical equipment stocked, including neck collars and long body boards.
As I step out of the ambulance, a bitter breeze nips at my face. Shattered glass, two crushed car hoods, and traffic everywhere, the scene is put into perspective as I can finally see what is happening. I stop in my tracks. It is my accident all over again.
""Get the collars and boards, there is a possible back injury,"" my partner whispers to me. I fetch the items, still attempting to deal with my conflicting emotions. Using the help of five other EMTs, we extricate the victim from the car and secure him to the stretcher. While in the ambulance, I realize now that circumstances have been reversed. This time, clutching the patient's hand, I tried to soothe him, and he slowly calms down. I keep my composure and actively tried to help the patient feel as comfortable as I did. Keeping all of his personal belongings close to me, we wheel him into the busy emergency room and transfer him safely. As we leave, he looked into my eyes and I could feel his sincere gratitude. Rather than being an innocent victim, like the current patient was, I am now the rescuer.
Even though I felt the horrid memories rushing back, I kept my duties as a rescuer in the forefront of my mind. Keeping my cool in the face of extreme pressure I came out of the call a changed person: someone who can see a problem, regardless of any bias I may have, and focus only on what is happening at that instant. Confidently facing my own terrors, I felt as if conquering my fears allowed me to face my duties with a grounded and compassionate outlook.
Tears stream, limbs hurt, children cry: I am there, with a smile on my face, a stethoscope around my neck, compassion in my heart, happy to help and proud to serve.",90.0,"You have chosen a significant experience that demonstrates your personal growth and passion for helping others. You have also provided vivid details and emotions that make your essay engaging and memorable. However, you could improve your content by adding some reflection on how this experience has influenced your goals, values, or beliefs.",85.0,"You have a clear and concise statement that summarizes the main idea of your essay: 'Rather than being an innocent victim, like the current patient was, I am now the rescuer.' However, you could improve your statement by placing it at the beginning of your essay, rather than at the end. This would help to capture the reader's attention and provide a roadmap for your essay.",95.0,"You have a well-organized essay that follows a logical sequence of events. You use transitions and paragraphs to connect your ideas and create a smooth flow. However, you could improve your organization by adding an introduction and a conclusion that frame your essay and restate your main point.",90.0,"You have a readable essay that uses clear and concise language and varied sentence structures. You also use punctuation and capitalization correctly. However, you could improve your readability by avoiding some minor errors and inconsistencies.",85.0,"You have a good command of grammar and syntax. You use subject-verb agreement, pronoun-antecedent agreement, and parallelism correctly. However, you could improve your grammar by avoiding some common errors and pitfalls.",89.0,"You have written a powerful and compelling essay that showcases your personal growth and passion for helping others. You have also demonstrated your writing skills and abilities. However, you could improve your essay by following the suggestions above."
"Some people think that the best way to reduce crime is to give longer prison sentences. Others, however, believe there are better alternative ways of reducing crime. Discuss both views and give your opinion. Give reasons for your answer and include any relevant examples from your own experience or knowledge. Write at least 251 words.","Crime is a serious and growing problem in most societies. Although many people believe that the best way to tackle this is to place people in prison for longer periods, others are of the opinion that other measures will be more effective.
There are benefits of giving offenders longer prison sentences. Firstly, spending a long time in prison provides an opportunity for the prison services to rehabilitate a prisoner. For example, someone who has committed a serious offence such as assault will need a long time in prison in order to be sure they can be re-educated not to re-offend. In addition to this, longer prison sentences will act as a deterrent for someone who is thinking of committing a crime.
However, some people argue that leaving people in prison for a long time means that they will mix with other criminals and so their character will not improve. One alternative is community service. This gives an offender the opportunity to give something positive back to society, and so it may improve their character. Also, the government could focus its resources on the causes of crime, which would lead to less crime in the future.
In my opinion, it is important to look at alternative methods. Many countries have lengthy prison sentences, but crime has continued to increase throughout the world, so it is clear that this is not completely effective. That said, long prison sentences should remain for those who commit serious crimes such as assault or murder, as justice for the victim and their family should take priority.
To conclude, there are good arguments for and against long sentences, so governments must continue to research the various methods of crime reduction to ensure effective policies are in place.",80.0,"You have addressed the topic and the task well. You have discussed both views and given your opinion with some reasons and examples. However, you could have developed your arguments more fully and provided more specific evidence to support your claims.",85.0,"You have a clear thesis statement that expresses your position and outlines the main points of your essay. However, you could have made it more specific and original by adding your own perspective or insight on the issue.",90.0,"You have a good structure for your essay, with an introduction, a conclusion, and four body paragraphs. You have used appropriate transition words and phrases to connect your ideas and paragraphs. However, you could have improved the coherence and cohesion of your essay by using more topic sentences and concluding sentences for each paragraph.",85.0,"You have used a range of vocabulary and sentence structures to convey your ideas clearly and effectively. However, you could have avoided some repetition and redundancy by using synonyms or paraphrasing.",80.0,"You have demonstrated a good command of grammar and punctuation. However, you made some minor errors that could have been avoided by proofreading your essay carefully.",84.0,"Your essay is well-written and shows a good understanding of the topic and the task. However, you can improve your essay by developing your arguments more fully, adding more originality and specificity to your thesis statement, enhancing the coherence and cohesion of your paragraphs, expanding your vocabulary and avoiding repetition, and correcting some minor grammar and punctuation errors."
Governments should be responsible for funding and controlling scientific research rather than private organizations. To what extent do you agree or disagree? Give reasons for your answer and include any relevant examples from your own experience or knowledge. Write at least 250 words.,"Undertaking scientific research is imperative if countries want to progress and compete in a globalized world. However, the funding and controlling of this research remain contentious issues. In my opinion, the government should have the predominant responsibility for these.
One of the first issues is the knowledge that we gain from research. If governments are responsible then they are driven by the need to make advances in knowledge in order to improve people鈥檚 lives. This is because they are accountable to the public and the research is paid for by taxes. On the other hand, private organizations are driven by profit. This may mean that some research that could be valuable to society may not begin because there is no monetary gain.
Another issue related to this is the research process. When the funding for research comes from the same organization that is going to gain from a favorable outcome, there is a strong potential for biased results. Taking drugs companies as an example, legislation usually requires rigorous trials for new drugs that can take many years to complete. The companies have large amounts of money invested in such research and the need for positive results is paramount. It is difficult for a scientist to remain impartial in these circumstances. However, if this is controlled and funded by governments, their accountability means that such conflicts of interest are less likely to occur.
On balance, I would argue that although it is not realistic to remove all opportunities for privately funded research, governments should have the main responsibility for the monitoring and controlling of this. Strong checks and balances need to be in place to ensure future research is ethical and productive.",85.0,"You have addressed the topic well and provided relevant examples and reasons to support your opinion. However, you could have elaborated more on the benefits of government-funded research for society and the drawbacks of privately funded research for scientific integrity. You could also have considered some counterarguments or alternative viewpoints to make your essay more balanced and convincing.",90.0,"You have clearly stated your opinion in the introduction and restated it in the conclusion. You have also used appropriate transition words and phrases to connect your paragraphs and sentences. However, you could have made your thesis statement more specific and focused by mentioning the main points you will discuss in your body paragraphs.",95.0,"You have organized your essay well into four paragraphs: introduction, two body paragraphs, and conclusion. You have also followed a clear structure for each paragraph: topic sentence, supporting sentences, and concluding sentence. However, you could have improved the coherence of your essay by using more cohesive devices such as pronouns, synonyms, or parallel structures to link your ideas.",90.0,"You have used a formal and academic tone throughout your essay. You have also varied your sentence length and structure to create interest and avoid monotony. However, you could have improved the readability of your essay by avoiding some repetition of words or phrases such as ``research``, ``responsible``, or ``on the other hand``. You could also have used some punctuation marks such as commas or semicolons to avoid run-on sentences or fragments.",95.0,"You have demonstrated a good command of grammar and vocabulary in your essay. You have used a range of grammatical structures and word forms correctly and accurately. However, you could have avoided some minor errors such as:
    - ``remain contentious issues`` -> ``remains a contentious issue`` (subject-verb agreement)
    - ``the need for positive results is paramount`` -> ``the need for positive results are paramount`` (subject-verb agreement)
    - ``their accountability means that such conflicts of interest are less likely to occur`` -> ``their accountability means that such conflicts of interest is less likely to occur`` (subject-verb agreement)
    - ``Strong checks and balances need to be in place`` -> ``Strong checks and balances needs to be in place`` (subject-verb agreement)",91.0,"Overall, you have written a good essay that meets the requirements of the task. However, you could have improved it by following some of the suggestions I have given above. I hope you find this feedback helpful and useful for your future writing."
Some people believe that personal happiness is directly related to economic success.Others believe there are other factors.Discuss the two sides and give your opinion.,"The pursuit of happiness has long been the dream of generations of human beings. They have always been puzzled Get Word (""puzzled""); by the essence of happiness. What is happiness? Is it closely related to one’s economic success? Will one’s financial success lead to happiness directly? Personally Get Word (""Personally""), I don’t agree that one’s economic success is the only prerequisite of one’s happiness in life.Happiness may fall into different categories Get Word (""categories"");. An old saying goes like this: “One man’s meat is another man’s poison”. Happiness may mean being a successful and respected leader of a company, or a stable and comfortable job in a large international company, or a big flat downtown, a fantastic set of furniture, etc. However, happiness can also be a harmonious and peaceful family, or a hospitable and considerate friend, or just a smile, a gesture, a hint. In fact, happiness may be composed of anything you could ever think of. At least, we may have two types of happiness: [wv]spiritualGetWord(""hospitable and considerate friend, or just a smile, a gesture, a hint. In fact, happiness may be composed of anything you could ever think of. At least, we may have two types of happiness: [wv]spiritual""); happiness and materialistic happiness.One’s materialistic happiness is dependant on one’s economic success, though not completely. Without a strong and steady economic background, one could never imagine an easy and simple life, let alone an affluent and luxurious one. If you aren’t able to afford a house, a car, or even a book, anybody would be horrified at the mere mention of this kind of life. Definitely, some people will feel happy right away if their basic demands for life are satisfied. However, we have to admit that these people still need to be successful materialisticallyGetWord(""materialistically""); to some degree.On the other hand, one’s success in economy may not necessarily lead to one’s spiritual happiness. As we all know, money doesn’t get you everything and some even say that money is the root of all evilsGetWord(""evils"");. One’s financial success may be built on the sacrifice of time, health and love, which are the three most essential elements of spiritual happiness. All of us are not new to this picture: a successful business man tasting loneliness alone with a broken heart.In my point of view, one’s economic success is only one of the key factors of happiness, but never the only one. To be happy, one needs to be both spiritually and materially satisfied Get Word (""satisfied""); though each of us may have a totally different picture of happiness.",80.0,"The essay discusses the two views about personal happiness, one that believes economic success is the only factor and the other that argues there are other factors. It also presents the author's opinion on the matter. The essay is well researched, and the author has presented valid arguments and examples to support their opinion. However, some points are repetitive, and the essay lacks depth.",90.0,"The essay statement is clear and concise, and the author has presented their opinion along with the two opposing views. The author has also used appropriate language to convey their ideas.",85.0,"The essay is well organized, and the author has followed the standard essay structure. The essay has an introduction, body paragraphs, and a conclusion. However, some points are repeated, which affects the flow of the essay.",80.0,"The essay is easy to read as the author has used simple language and sentence structures. However, some sentences are too lengthy, and there are minor punctuation errors.",75.0,"The essay has some grammatical errors, such as incorrect verb tenses and subject-verb agreement. There are also some minor errors in punctuation and capitalization.",82.0,"Overall, the essay is well-written, and the author has presented their opinion on the matter. However, the essay can be improved by focusing on the depth of the content, avoiding repetition, and addressing the grammatical errors."
Topic：Water resources around the world are falling deficient. Analyze the possible reasons and provide your suggestions.,"Access to water is vital to every living creature on the planet. Despite the fact that approximately two thirds of the earth surface is covered with all forms of water bodies, countries worldwide are faced with different levels of water shortages. Some reasons can be cited to explain the emergence of this problem.A trigger for water crisis is people’s lack of knowledge of the value of the water. Given the ready availability of water in many countries, people tend to believe that the reserve of water in the world is infinite. Notwithstanding the increased expenditure on water supply, water is perceived as a cheap commodity by many families. Many people see water a perpetual resource. For this reason, the unbridled use of water is commonplace, accelerating the exhaustion of this valuable resource.Rapid population growth is another force contributing to the water crisis. Not only does it reduce the amount of water available for manufacture, farming and households, but also has a profound effect on the sustainability of aquatic ecosystems. Massive urban and industrial growth fuels unprecedented demands, often at the expense of aquatic ecosystems. Many water resources are not replenished before being re-used and depleted.Human-induced pollution is worthy of concern as well, a factor regarded by many as the root cause of the rapid loss of drinkable water. The untreated discharge of various pollutants such as heavy metals, organic toxins, oils and solids in water bodies is believed to have severe impacts. Industrialization, meanwhile, results in abnormal climate and biological destruction. While some areas have become barren, other areas are hit by floods. Floods ravage everything, including reservoirs, dams and cannel. The water supply problem will intensify.As noted above, the steady loss of water is attributable to inappropriate usage, population growth and pollution. In order to tackle the above-mentioned problems, one can adopts various approaches, besides the existing strategies, such as restoration of ecosystems, rainwater harvest. New technologies can help ease water shortages, by tackling pollution and making used water recyclable. In agriculture, water use can be made far more efficient by introducing new farming techniques (e.g. drip irrigation). Drought-resistant plants can help cut the amount of water needed.",75.0,"The essay discusses some of the possible reasons for the falling water resources around the world. It highlights the lack of knowledge of the value of water, population growth and human-induced pollution as the key factors behind the depletion of water resources. The essay also provides some suggestions to tackle these issues, such as the adoption of new technologies, restoration of ecosystems, rainwater harvesting, and efficient farming techniques. However, it lacks depth in its analysis and fails to provide evidence to support its claims. ",70.0,"The essay presents its statement, which is that water resources around the world are falling deficient. However, the essay fails to provide a clear thesis statement that guides the reader throughout the essay. The essay could benefit from a more explicit argument that would help the reader understand the purpose of the essay.",80.0,"The essay is generally well-organized, with the author providing clear sections that separate the introduction, the main body, and the conclusion. The main body of the essay is organized around three key factors contributing to the water crisis, with each factor being discussed in more detail. However, the flow of the essay could have been improved with more effective transitions between the paragraphs and the sections.",80.0,"The essay is written in clear, concise language, making it easy for the reader to follow. The essay lacks some depth in the analysis, and it could benefit from more examples and evidence to support its claims. Overall, the readability of the essay is good, but it could be improved with more engaging content.",85.0,"The essay has some grammatical errors, but it is generally well-written. There are some issues with verb tense, subject-verb agreement, and sentence structure that could be improved. However, these errors do not significantly impact the clarity of the essay.",78.0,"Overall, the essay provides an overview of the factors contributing to the global water crisis and some suggestions to tackle this issue. However, it lacks depth in the analysis, and it could benefit from more evidence and examples to support its claims. To improve the essay, the author should focus on providing a clear thesis statement, enhancing the analysis, providing more evidence, and improving the transitions between paragraphs and sections."
Trying to save endangered animal species from extinction is a waste of valuable resources.Do you agree or disagree?,"The issue of whether we should attempt to save endangered species from extinction or not is certainly a contentious one. Despite the arguments of some people that such animals serve no useful purpose and should be allowed to die out just as many others (including the dinosaurs) have in the past, it is my personal belief that they should in fact be preserved. Two of the principal reasons for this are as follows.Firstly, it is vital that we appreciate the importance of endangered species in maintaining the balance of nature. Ecosystems are delicate arrangements where plants and animals all depend on each other for survival. The disappearance or introduction of any animal species disrupts the balance and negatively impacts upon other plants and animals by breaking the food chain and altering the habitat in which they live. Such imbalances frequently return to haunt us in unexpected ways. Just as rabbits that were introduced to Australia soon after European settlement now compete with native species for food and destroy farmers’ crops, the extinction of a predator can cause plagues by allowing its prey to multiply unchecked. Therefore, since ecological change constitutes a potential risk to us and our environment, it is clearly I our own interests to protect endangered species.Yet, perhaps the strongest argument in favor of preserving endangered species is that all life has intrinsic value; even if endangered species are not useful to us in any practical way they should be preserved nevertheless. Further, given that we humans are responsible for destroying the natural habitat of many endangered animals, we should make every possible effort to save them.In conclusion, I once again restate my view that saving endangered species is worthwhile. Not only do they help to maintain the balance of nature, but they also have value in and of themselves.",85.0,"The essay presents two compelling reasons for why endangered species should be preserved, namely to maintain the balance of nature and to uphold the intrinsic value of life. These reasons are supported with relevant examples and the writer makes clear that protecting endangered species is in our own interest. However, the essay could have been stronger if it included counterarguments to present a more balanced view of the issue.",90.0,The essay clearly states the writer's position on the issue and provides reasoning to support it. The writer also acknowledges the opposing viewpoint but ultimately argues against it.,80.0,"The essay has good coherence and cohesion, but could benefit from a stronger introduction to provide greater context for the discussion. The conclusion effectively reiterates the writer's stance and summarizes the main points of the essay.",85.0,The essay is easy to follow and understand. The writer uses clear and concise language and the ideas flow logically.,90.0,"There are only minor errors in grammar, punctuation, and spelling, which do not detract from the overall clarity of the essay.",86.0,"Overall, the essay presents a clear and well-constructed argument in favor of preserving endangered species. To further improve, the essay could have considered and refuted counterarguments to provide a more comprehensive view of the issue. The essay could also benefit from a more engaging introduction to grab the reader's attention and provide greater context."
