Topic,Essay,Content_Mark,Content_Comment,Statement_Mark,Statement_Comment,Organization_Mark,Organization_Comment,Readability_Mark,Readability_Comment,Grammar_Mark,Grammar_Comment,Overall_Mark,Overall_Comment
"International tourism is now more common than ever before. Some feel that this is a positive trend, while others do not.What are your opinions on this?","During the past few decades, people either in developed countries or developing ones have witnessed a substantial growing of the international tourism; this, no double, brought happiness to the tourists and prosperity to the recipient countries. Nonetheless, in my view, the overall impact of the ever-growing international holiday-** would be considered negative. The reasons for this are manifold.In the first place, the influx of international tourists does not merely bring the host countries economical prosperity, but bring with them the harmful cultural defects. Such as prostitution as well as alcoholism and substance abuse, just to satisfy the needs of these holidaymakers. And all of these render originally peaceful and pure countries to be a place with crime and instability.In the second place, the international tourism also creates pollutions as well as cause damage to certain attractions. For one thing, the fossil fuel consumed during the journey and the pollutants left behind by the tourists possess grave threaten to the local environment and the ecosystem. A very salient example is the Great barrel reef in Australia. During the past few years, the visiting of countless boats, divers caused devastating damage to the coral live around the reef; the world renowned “Kuta” beach has also been polluted a lot by the tourists these years.Finally, the quick money provides by the international tourism renders the local people become snobbish. Children who are no more than 16 abandon their school to provide specific services to the tourists simply for earning some humble incomes. This phenomenon has been exacerbated during the past few years especially in the developing countries like Thailand and Indonesia.In conclusion, I strongly believe that the overall effect of the international tourist industry is bad. This condition would remain the same for a relatively long period of time and the government should take methods to curb the negative impacts that this would generate.",85.0,"The essay provides a clear and substantial argument on the negative impact of international tourism. The writer presents valid points such as cultural degradation, environmental damage, and socioeconomic issues. However, the essay lacks counterarguments and fails to acknowledge some of the positive impacts of tourism, such as job creation and cultural exchange.",70.0,"The thesis statement is not well-defined and lacks clarity. The writer fails to state their stance on the matter clearly, causing confusion for the reader. The essay lacks a distinctive introduction, and it is difficult to establish the purpose of the author's writing.",75.0,"The essay has a clear structure, with well-defined paragraphs, and topic sentences. However, the essay needs to be more coherent and unified, as some paragraphs stray from the main point. There is a lack of smooth transitions between paragraphs, making it difficult to follow the writer's train of thought.",80.0,"The essay is readable, but it needs minor improvements to make it more interesting. The writer uses repetitive language and could benefit from more varied sentence structures. The vocabulary needs to be widened to provide more expressive writing.",85.0,"The grammar in the essay is acceptable, but there are still some errors, especially in verb tenses and word choice. There is also an issue with sentence fragments and run-on sentences, which affect the coherence of the writing.",79.0,"Overall, the essay provides a clear argument on the negative impacts of international tourism. However, the essay falls short in establishing a clear thesis statement and lacks counterarguments. The writer should organize the essay in a more coherent and unified manner, with smoother transitions between paragraphs. Adding more varied vocabulary and sentence structures would also enhance the readability of the essay. Finally, proofreading for grammar and syntax would help eliminate errors and improve the overall quality of the writing."
It is generally acknowledged that the relationship among family members is now not as close as it used to be. Give possible reasons and your recommendations.,"Nowadays, couples quarrel more often than they used to do. Brothers and sisters talk less and take less care of each other. Children turn less to their parents for advice. These scenes are just part of the whole picture of today's family alienation. As far as I am concerned, there are several reasons for these phenomena. The first reason is that people spend more time on their studies and work. Nowadays, people face fierce competition and suffer from great pressure. As a result, they have to devote more time and energy to their careers. Some people are too busy to spare time for their family. What is more, many jobs require people to work in other cities and many children have to leave their parents at an early age to study or work elsewhere. As time passes, these people become emotionally estranged from their families.The alienation among families is also attributed to the increasing number of entertainments available.High technology brings modern people more interesting things which can easily attract their attention such as watching TV, surfing the Internet or playing video games. Consequently, people are addicted to these activities, totally neglecting the feelings of their family members.Last but not least, people are now more independent than before. Apart from their family, they can easily get help from their friends and it is much easier to make more friends as a result of the rapid improvement in telecommunication. Therefore they are not as dependent on their families as before. To bring families closer, people put forward various suggestions. First, we should spare more time with our family members, no matter how occupied we are. Second, teach children the sense of family when they are still young. Last but not least, the government should organize activities to promote public awareness of the importance of a harmonious family relationship.",70.0,"The essay adequately addresses the reasons behind the increasing lack of closeness among family members, such as increased competition and work pressure, the availability of entertainment, and increased independence. However, the essay could have been more informative if it had provided specific examples of how these factors contribute to family alienation and how they have changed over time. Additionally, the essay could have benefited from more thorough analysis of the issue.",65.0,"While the essay did have a thesis statement, it was weak and vague. The essay should have provided a stronger thesis that directly addressed the prompt and was supported throughout the essay.",70.0,"The essay was adequately organized, with a clear introduction and conclusion, and three supporting paragraphs. However, the essay could have been more effective if it had used more transitional phrases to seamlessly connect ideas and paragraphs.",75.0,"The essay was readable, but it could have been more engaging if it had utilized more varied sentence structures and word choices. The essay also had some awkward phrasing, which could cause confusion for the reader.",80.0,"The essay was relatively well-written, but it could have benefited from proofreading. There were several grammatical errors, such as subject-verb disagreement and missing articles, which could detract from the overall quality of the essay.",72.0,"Overall, the essay addressed the prompt and provided some insightful reasons behind the increasing lack of closeness among family members. However, the essay could have been improved by providing specific examples, a stronger thesis, more transitional phrases, more varied sentence structures, and proofreading."
Do you agree or disagree with the following statement? One should not give up on getting a degree just because she is a little older. Use specific reasons and examples to support your answer.,"An apt rewording of the statement could be that people are never too old to learn. Learning is definitely a lifelong process. A structured environment could very well facilitate the flow of information. These require more discussion.Whatever, the influence, people are always picking up new ideas. This is advantageous for a number of reasons. Primarily, humans look for ways to make things easier, which affects our daily life positively, leaving time for other things like family and relaxation. So, regardless of how people acquire information, it still equals learning. Each time one drives a new way to work in order to save time, he is learning. Similarly, to get things we want, we sometimes have to go through structured programs to get more knowledge on a subject. This, perhaps, may help to get a promotion, receive a higher salary, or even start a new career. Quite a few institutions have recognized this and have planned curricula in response to growing need.The advent of the Internet and other outreach programs has caused an explosion in programs for nontraditional university students. Now, more schools than ever have special programs whereby a student may get a BA, MA, or a PhD without ever attending one class at the university. Our world have become so filled up with other responsibilities that we rarely have the opportunity to attend school, as people did fifty years ago. But diligent school administrators have provided us the luxury of attending school in the comfort of our own homes. The structure of the traditional classroom is not the only one available to meet our needs. The people who were for years looked at sideways for being thirty and returning to school have now supplanted the focus of programs tailored around wants and academic needs. New departments have sprung up, or old ones have taken on a new mission. Currently, they include telling names, such as lifelong learning, adult learners, nontraditional students, distance programs, lifelong education, and many others. The educational institutions are changing with the times.As technology changes to help us, we will change to better help ourselves. There really are an inordinate number of opportunities to get the education if one wants it badly enough. The population of nontraditional-age students has skyrocketed, so one should never fell out of place. Doing the work is simply a question of priority.",60.0,"The essay attempts to address the statement and provide support for the idea that age should not be a barrier to getting a degree. However, the essay lacks coherence, focus, and depth. The essay touches upon various ideas but does not develop any of them satisfactorily. The essay claims that people are never too old to learn, and learning is a lifelong process, and then goes on to provide examples that mostly relate to informal learning. Moreover, the essay does not provide specific reasons and examples to support the agreement or disagreement with the statement. The essay concludes by stating that technology has opened up learning opportunities for nontraditional-age students. However, the essay does not explain how these opportunities have made it easier for older students to get degrees.",50.0,"The essay's statement is unclear and imprecise. Instead of stating whether they agree or disagree with the statement, the essay attempts to paraphrase the statement and then proceeds to discuss the general idea of age never being a barrier to learning. The essay does not provide a clear statement that guides the essay's focus.",40.0,"The essay lacks coherence and proper organization. The essay jumps from one idea to another without proper transitions and connections. The essay starts with a discussion of learning being a lifelong process and then immediately jumps to how people look for ways to make things easier. Most of the essay consists of general ideas and examples, without any clear structure or focus. The essay could benefit from a clear introduction, thesis statement, and body paragraphs that develop specific ideas and support the thesis.",55.0,"The essay is challenging to read due to its lack of coherence and organization. The essay's sentences are often unclear and disconnected, making it hard for the reader to comprehend the essay's main idea. The essay could benefit from shorter sentences, varied sentence structures, and logical flow.",70.0,"The essay's grammar is adequate, with only a few errors in syntax, tense, and subject-verb agreement. However, the essay's use of language is often imprecise, making the essay's ideas hard to understand. The essay could benefit from carefully proofreading and editing to enhance clarity and precision.",55.0,"Overall, the essay attempts to discuss the idea of age not being a barrier to getting a degree, but lacks coherence, focus, and depth. The essay could benefit from a clear thesis statement and organization that develops specific ideas and provides examples to support them. Moreover, the essay could benefit from enhanced clarity and precision in language use to enhance readability."
"Some people claim living in a rural area is better than living around a lot of people. Use specific reasons and details to support your answer.

","People call the city or the small town home for a wealth of reasons, each having its own advantages and disadvantages. Primarily, the small-town people espouse familiarity. In contrast, the city dwellers hide amidst the anonymity. These statements require further scrutiny.In a small town or in the country, the citizens become acquainted rather quickly. This acquaintance has several subtopics to it. First, families become friends for many generations, and that has a profound impact on lives. The families sometimes intermarry. Consequently, if people do relocate, often they later return to their original home, because both sets of parents live there. Next, land is often involved. Therefore, a kinship is made to the area and not only the people. It is difficult to walk away from an inheritance involving land. Finally, people work together on community projects, bonding them together by the process of building something. If a new Wal-Mart comes to town, everyone feels the spirit of progress together. This stands in direct contrast to life in the city.The city has many attractive features that lure, just like the small town. The idea of not being readily recognized may appeal to some. With several million people in a metropolis and its surrounding areas, one could go for years and never run into an acquaintance. The probably usually have no desire to return someplace after they leave. There is nothing to keep them stationary. In addition, in that there is no kinship to land, city dwellers like the freedom of mobility. They could move every several months and always have something new. As the city consistently experiences growth, one may look for the best spot to live, replete with post office, and array of restaurants, diversity of culture, and any number of conveniences. The only link a city dweller has in a lot of cases to anything is his own desire to be free. Additional comments follow.The city and the small town have many benefits to consider. What is right to start out life could change as one gets older. People are lucky at times that they do not have to choose, at least not forever, but can move at will. Maybe this is why some richer people have homes both in the small town and in the city.

",75.0,"The essay discusses the advantages and disadvantages of living in a small town versus living in a city. The writer provides reasons for why some people prefer small towns, such as the sense of community and attachment to land, as well as reasons for why some people prefer the anonymity of the city. However, the writer fails to fully address the prompt, which asks whether living in a rural area is better than living around a lot of people. The essay could benefit from more specific reasons and details to support the argument that living in a rural area is better.",70.0,"The writer's argument is not clearly stated. The essay discusses the advantages and disadvantages of both living in a small town and living in a city, but it does not take a clear stance on whether living in a rural area is better. The writer would benefit from stating a clear thesis and providing reasons and evidence to support it.",75.0,"The essay is organized into paragraphs, which is a good start. However, the writer could benefit from a clearer structure that follows a logical order. The essay jumps from discussing small towns to discussing cities without a clear transition. Additionally, some paragraphs could be more fully developed.",80.0,"The essay is generally easy to read, but the writing could benefit from more variety in sentence structure. The writer tends to use short, simple sentences, which can make the essay feel choppy and uninteresting. Additionally, the essay could benefit from more engaging language and tone.",70.0,"The essay contains several grammatical errors, such as missing or misplaced punctuation, subject-verb agreement errors, and awkward phrasing. The writer would benefit from proofreading more carefully and seeking out feedback on grammar and syntax.",74.0,"Overall, the essay has potential, but it would benefit from a clearer thesis statement, more focused organization, and more specific evidence to support the argument that living in a rural area is better. Additionally, the writer could improve readability by varying sentence structure and using more engaging language. Finally, the essay could benefit from more careful proofreading to eliminate grammatical errors."
Topic：Water resources around the world are falling deficient. Analyze the possible reasons and provide your suggestions.,"Access to water is vital to every living creature on the planet. Despite the fact that approximately two thirds of the earth surface is covered with all forms of water bodies, countries worldwide are faced with different levels of water shortages. Some reasons can be cited to explain the emergence of this problem.A trigger for water crisis is people’s lack of knowledge of the value of the water. Given the ready availability of water in many countries, people tend to believe that the reserve of water in the world is infinite. Notwithstanding the increased expenditure on water supply, water is perceived as a cheap commodity by many families. Many people see water a perpetual resource. For this reason, the unbridled use of water is commonplace, accelerating the exhaustion of this valuable resource.Rapid population growth is another force contributing to the water crisis. Not only does it reduce the amount of water available for manufacture, farming and households, but also has a profound effect on the sustainability of aquatic ecosystems. Massive urban and industrial growth fuels unprecedented demands, often at the expense of aquatic ecosystems. Many water resources are not replenished before being re-used and depleted.Human-induced pollution is worthy of concern as well, a factor regarded by many as the root cause of the rapid loss of drinkable water. The untreated discharge of various pollutants such as heavy metals, organic toxins, oils and solids in water bodies is believed to have severe impacts. Industrialization, meanwhile, results in abnormal climate and biological destruction. While some areas have become barren, other areas are hit by floods. Floods ravage everything, including reservoirs, dams and cannel. The water supply problem will intensify.As noted above, the steady loss of water is attributable to inappropriate usage, population growth and pollution. In order to tackle the above-mentioned problems, one can adopts various approaches, besides the existing strategies, such as restoration of ecosystems, rainwater harvest. New technologies can help ease water shortages, by tackling pollution and making used water recyclable. In agriculture, water use can be made far more efficient by introducing new farming techniques (e.g. drip irrigation). Drought-resistant plants can help cut the amount of water needed.",85.0,"The essay covers the reasons for water shortage around the world and suggests possible solutions to deal with the issue. The author explains three main causes, namely, lack of knowledge about water value, population growth, and pollution. Additionally, the author presents a convincing argument about the severity of water scarcity related problems, including depletion of aquatic ecosystems, abnormal climate, and floods. The author further provides practical suggestions to mitigate the water shortage issue, such as restoration of ecosystems, rainwater harvesting, new technologies, introduction of drip irrigation, and use of drought-resistant plants. Overall, the content is relevant to the given topic, and the arguments presented are supported by valid points. However, the essay could be strengthened by providing more statistical data and examples to emphasize the severity of the issue.",80.0,"The thesis statement of the essay is clear and concise. The author's stance is well-defined, and the arguments presented are consistent with the main idea. The essay begins with a strong introduction, and each paragraph flows logically into the next. However, some statements lack clarity and precision, making it difficult for readers to grasp the author's intent. For example, the sentence ""Many water resources are not replenished before being reused and depleted,"" is vague.",75.0,"The essay follows a logical structure of introduction, body, and conclusion. Each paragraph focuses on a particular idea and ends with a smooth transition to the next section. The author has managed to maintain coherence throughout the essay by using appropriate linking words and phrases. However, the essay could be improved by giving more attention to paragraph development and arrangement. Some paragraphs are too long while others are too short, which affects the flow of the essay.",85.0,"The essay is understandable, and the language used is simple, direct, and appropriate for the target audience. The author has used a variety of sentence structures to create interest and credibility. However, the essay could be enhanced by avoiding avoidable errors such as awkward phrasing and unnecessary repetition of words and ideas.",90.0,"The author has demonstrated good command of grammar, and punctuation rules. The essay is free from significant grammatical errors. However, some minor punctuation errors could have been avoided by proofreading the essay before submission. For example, the sentence ""Notwithstanding the increased expenditure on water supply, water is perceived as a cheap commodity by many families"" would be improved by deleting the comma after 'supply.'",83.0,"The essay provides a good analysis of water scarcity and suggests practical ways to solve the issue. The author's arguments are relevant, and the content is informative. However, to enhance the effectiveness of the essay, the author needs to provide more evidence to support the arguments presented. The essay would benefit from the inclusion of statistical data and examples from different parts of the world to highlight the severity of the crisis. Moreover, the author needs to work on paragraph development, arrangement, and coherence to ensure the essay flows smoothly and logically. Finally, the author should proofread the essay thoroughly to eliminate minor errors such as punctuation mistakes and awkward phrasing. Overall, the essay is well written, and with a little improvement, it would be an excellent piece of writing."
